Seated Groin Stretch|Hip Adductors|Adductors, Hip|Stretch|Sit on floor or mat with soles of feet together on floor and close to body. Grasp feet with both hands and position elbows on inside of lower legs.Press knees toward floor with elbows. Hold stretch.|Basic|https://www.rocketdogrescue.org/wp-content/uploads/2016/08/dog-working-out.jpg|False
Trap Bar Stiff Leg Deadlift|Low Back|Erector Spinae|Barbell|Stand on platform under loaded trap bar. Squat down and grasp handles to sides.Lower bar by bending hips. Bend knees slightly during descent and keep waist straight, flexing only slightly at bottom. With knees bent, lift bar by extending at hips until standing upright. Pull shoulders back slightly if rounded. Extend knees at top if desired. Repeat.|Basic|https://www.rocketdogrescue.org/wp-content/uploads/2016/08/dog-working-out.jpg|False
Dumbbell Incline Shoulder Raise|Serratus|Serratus Anterior|Dumbbell|Sit down on incline bench with dumbbells resting on lower thigh. Kick weights to shoulders and lean back. Position dumbbells above shoulders with elbows extended.Raise shoulders toward dumbbells as high as possible. Lower shoulders to bench and repeat.|Basic|https://www.rocketdogrescue.org/wp-content/uploads/2016/08/dog-working-out.jpg|False
Lever Pulldown|Lats|Latissimus Dorsi|Lever (selectorized)|Sit on seat. Reach up and grasp handles with wide overhand grip.Pull levers down to sides of shoulders. Return until arms and shoulders are fully extended. Repeat.|Basic|https://www.rocketdogrescue.org/wp-content/uploads/2016/08/dog-working-out.jpg|False
Seated Adductor Magnus Stretch|Adductor Magnus|Hip Adductors|Stretch|Sit on floor or mat with feet far apart and knees bent approximately 90 degrees. Reach forward grasp bottom of feet.Pull torso forward and hold stretch.|Basic|https://www.rocketdogrescue.org/wp-content/uploads/2016/08/dog-working-out.jpg|False
Lever Donkey Calf Raise (plate loaded)|Calf|Gastrocnemius|Lever (plate loaded)|Position lower back and hips under padded lever. Place forearms on supports. Position toes and balls of feet on calf block with arches and heels extending off. Straighten knees.Raise heels by extending ankles as high as possible. Lower heels by bending ankles until calves are stretched. Repeat.|Basic|https://www.rocketdogrescue.org/wp-content/uploads/2016/08/dog-working-out.jpg|False
Cable Roller Wrist Extension|Wrist Extensors|Wrist Extensors|Cable|Stand behind weight plate(s) on floor and grasp wrist roller handle with both hands; over hand grip.With left hand gripping handle, relax grip of right hand and slide grip in front of handle (by flexing wrist) and regrip. Relax grip of left hand and hyperextend right wrist. Repeat sequence with opposite hands, alternating back and forth until weight plate has raised up near hands. Lower weight steadily with opposite movement.|Basic|https://www.rocketdogrescue.org/wp-content/uploads/2016/08/dog-working-out.jpg|False
Sled Single Leg Lying Leg Press (plate loaded)|Glute|Gluteus Maximus|Leg Presses|Lie supine on platform with shoulders against pad. Place feet slightly high on platform. Prop one leg up, on support if available. Extend hip and knee of leg positioned on platform. Release dock lever and grasp handles to sides if available.Bring sled toward platform by flexing hip and knee of supporting leg until knee is just short of complete flexion or until hip is completely flexed. Return by extending knee and hip. Repeat. Continue with opposite leg.|Basic|https://www.rocketdogrescue.org/wp-content/uploads/2016/08/dog-working-out.jpg|False
Dumbbell Push Sit-up|Abs|Rectus Abdominis|Dumbbell|Position feet under foot pad and lie supine on flat or incline bench. Position dumbbells straight over shoulders.Raise torso from bench as high as possible by bending waist and hips. Keep weight positioned above shoulders. Achieve near upright posture (hip flexibility, incline, and initial hip position permitting). Return to original lying posture with back of shoulders, contacting padded incline board. Repeat.|Basic|https://www.rocketdogrescue.org/wp-content/uploads/2016/08/dog-working-out.jpg|False
Suspended Self-assisted Chest Dip|Chest|Quadriceps|Suspended|Stand between two suspension handles, approximately mid-thigh height. Grasp handles on each side and straighten arms with shoulders above hands. Hold position firmly and place portion of body weight on handles.Lower body by bending arms back. If necessary, use minimal assistance of lower body to control descent, allowing knees to bend, keeping feet in contact with floor. When slight stretch is felt in chest or shoulders, push body up back up until arms are straight. Repeat with minimal assistance from legs.|Basic|https://www.rocketdogrescue.org/wp-content/uploads/2016/08/dog-working-out.jpg|False
Seated Bent Leg Calf Stretch|Inner Calf|Soleus|Stretch|Sit of floor or mat. Place heel on floor or mat with bent knee upright. Grasp top of forefoot.Pull forefoot toward shin. Repeat with opposite leg.|Basic|https://www.rocketdogrescue.org/wp-content/uploads/2016/08/dog-working-out.jpg|False
Angled Side Bridge Hip Abduction|Abductors|Tensor Fasciae Latae|Body Weight|Grasp vertical bar with one hand and turn to side. Position feet out away from vertical bar with arm supporting body extended out to side. Legs should be straight and positioned side by side. Supporting arm should be approximately vertical to body and other arm can be placed on hips. Lower hips downward to floor until slight stretch is felt.Keeping foot closest to bar on ground, raise hips upward and away from bar while raising leg furthest from bar upward away from lower leg. Return to original position with hips sagging downward and repeat. Continue with opposite leg.|Basic|https://www.rocketdogrescue.org/wp-content/uploads/2016/08/dog-working-out.jpg|False
Barbell Standing Reverse Preacher Curl|Brachioradialis|Brachioradialis|Barbell|Place back of arms on pad with one foot forward. Grasp curl bar with shoulder width underhand grip.Raise bar until forearms are vertical. Lower barbell until arm is fully extended. Repeat.|Basic|https://www.rocketdogrescue.org/wp-content/uploads/2016/08/dog-working-out.jpg|False
Suspended Bent-knee Inverted Row|Back|Trapezius, Middle|Suspended|Position suspension handles higher than arms' length above floor. Sit on floor and grasp handles. Hang shoulders under handles with arms straight, back and hips straight, with knees bent and feet flat on floor.Pull body up so sides of chest make contact with handles while keeping body straight. Return until arms are extended straight and shoulders are stretched forward. Repeat.|Basic|https://www.rocketdogrescue.org/wp-content/uploads/2016/08/dog-working-out.jpg|False
Self-assisted Rear Pull-up|Lats|Quadriceps|Self-assisted|Grasp bar with overhand wide grip. Position forefeet on floor just behind low bar or on bench just behind high bar.Lower body until arms and shoulders are fully extended. If necessary, use minimal assistance of lower body to control descent allowing knees to bend. Pull body up until bar touches back of neck, again with minimal assistance from lower body. Repeat.If bar is too low, knees may need to spread apart at bottom of motion (as shown) to achieve full range of motion. Range of motion will be compromised if grip is|Basic|https://www.rocketdogrescue.org/wp-content/uploads/2016/08/dog-working-out.jpg|False
Lever Seated Reverse Fly (overhand grip)|Rear Delt|Latissimus Dorsi|Lever (selectorized)|Sit on machine with chest against pad. Grasp horizontal handles with overhand grip at shoulder height. Internally rotate shoulders so elbows are also at height of shoulders.Keeping elbows pointed high, pull handles apart and to rear until elbows are just behind back Return and repeat.|Basic|https://www.rocketdogrescue.org/wp-content/uploads/2016/08/dog-working-out.jpg|False
Lever Reclined Shoulder Press (plate loaded)|Front Delt|Deltoid, Anterior|Lever (plate loaded)|Lie on back pad facing up. Grasp lever handles on each side with overhand grip.Press lever until arms are extended. Lower and repeat.|Basic|https://www.rocketdogrescue.org/wp-content/uploads/2016/08/dog-working-out.jpg|False
Cable Seated Shoulder Internal Rotation|Internal Rotators|Subscapularis|Cable|Sit with side to low pulley. Grasp cable stirrup with near arm. Position elbow against side with elbow bent approximately 90°.Pull cable stirrup toward body by internally rotating shoulder until forearm is across belly. Return and repeat. Continue with opposite arm.|Basic|https://www.rocketdogrescue.org/wp-content/uploads/2016/08/dog-working-out.jpg|False
Bent Knee Side Bridge Hip Abduction|Abductors|Tensor Fasciae Latae|Body Weight|Lie on side with legs bent back 90 degrees, one leg on top of the other. Place forearm under shoulder perpendicular to body.Keeping shank of lower leg on mat or floor, raise hips up off ground while raising upper leg upward away from lower leg. Return to original position and repeat. Continue with opposite leg.Keep knees bent throughout exercise. Exercise can be performed on mat or towel or cushioning can be placed under forearm. See|Basic|https://www.rocketdogrescue.org/wp-content/uploads/2016/08/dog-working-out.jpg|False
Step-down|Glute|Gluteus Maximus|Body Weight|Stand with one foot on bench or elevated surface. Position foot on elevated surface to side, forward of straight knee.Stand on bench by straightening leg and pushing body upward. Step down returning foot off of bench to floor and repeat. Continue with opposite position.Keep torso upright during exercise. Knee of exercised leg should point same direction as foot. SeeExercise can also be performed by placing travelling foot onto and off of bench next to foot of exercised leg (SeeWeighted versions of this exercise would normally be considered auxiliary in context of other basic exercises (ie: Barbell Squat, Sled Leg Press). However, in the context of 'body weight' only program, this exercise can be considered basic.|Basic|https://www.rocketdogrescue.org/wp-content/uploads/2016/08/dog-working-out.jpg|False
Hanging Windshield Wiper|Obliques|Rectus Femoris|Body Weight|Grasp and hang from high bar with shoulder width overhand grip. With arms straight, raise hips and position legs vertically by extending shoulders and flexing hips.Turn legs to one side by rotating waist until stretch is felt through waist. Rotate legs to opposite side in same manner. Continue by rotating from side to side.Alternative easier mount involves raising hips with knees bent, then extending legs upward. Arms and legs may bend slightly throughout movement. Knees may bend more during movement if hamstrings are somewhat tight. Although some movement occurs through shoulders and scapula, engaged musculature is classified as stabilizer since movement is relatively limited.For less resistance, bend knees more or perform movement on floor.For greater resistance, wear ankle weights or hold medicine ball between feet.|Basic|https://www.rocketdogrescue.org/wp-content/uploads/2016/08/dog-working-out.jpg|False
Single Leg Reclining Squat (bar)|Glute|Quadriceps|Body Weight|Stand behind horizontal bar, lower chest to upper waist height. Grasp bar with both hands. Place feet slightly forward and lean back with arms straight. Balance on one leg with opposite leg extended forward off of ground.While reclining back, squat down as far as possible while keeping leg elevated off of floor. Keep back straight and supporting knee pointed same direction as suppor ting foot. Raise body back up to original position until knee and hip of supporting leg is straight. Repeat and continue with opposite leg.Supporting knee should point same direction as foot throughout movement. Range of motion will be improved with greater leg strength andThis exercise would normally be considered auxiliary in context of other basic exercises (ie: Barbell Squat, Sled Leg Press). However, in the context of 'body weight' only program, this exercise can be considered basic.Also see|Basic|https://www.rocketdogrescue.org/wp-content/uploads/2016/08/dog-working-out.jpg|False
Ball Crunch (on stability ball)|Abs|Rectus Abdominis|Body Weight|Sit on exercise ball. Walk forward on ball and lie back on ball with shoulders and head hanging off and knees and hips bent. Gently hyperextend back on contour of ball. Place hands behind neck or beside head.Flex waist to raise upper torso. Return to original position. Repeat.Certain individuals may need to keep their neck in neutral position with space between their chin and sternum. Some individuals may experience low back discomfort if hips are not bent so they must use smaller|Basic|https://www.rocketdogrescue.org/wp-content/uploads/2016/08/dog-working-out.jpg|False
Sled Lying Leg Press|Glute|Gluteus Maximus|Leg Presses|Lie supine on platform with shoulders against pad. Place feet slightly high on platform.Extend hips and knees. Return until hips are completely flexed. Repeat.|Basic|https://www.rocketdogrescue.org/wp-content/uploads/2016/08/dog-working-out.jpg|False
Barbell Behind Neck Press|Front Delt|Deltoid, Anterior|Barbell|Grasp barbell with overhand grip from rack orPress bar upward until arms are extended overhead. Return behind neck and repeat.|Basic|https://www.rocketdogrescue.org/wp-content/uploads/2016/08/dog-working-out.jpg|False
Hanging Straight Hip Leg Curl|Hamstrings|Hamstrings|Body Weight|Lay supine under fixed horizontal bar. Grasp bar with wide overhand grip. Straighten and raise body off of floor keeping heels on floor.Pull body toward feet by bending knees while keeping hips straight. Roll onto feet until knees are fully flexed. Return body to original position by extending knees. Repeat.Positioned bar so back is slightly above floor once grip is established. Keep low back and hips straight throughout movement. With hips fully extended, Hamstrings enter|Basic|https://www.rocketdogrescue.org/wp-content/uploads/2016/08/dog-working-out.jpg|False
Lying Bent Leg Oblique Stretch|Obliques|Obliques|Stretch|Lie supine on floor or mat. Bend knees and place feet flat on floor.Bring both knees and hip to one side. Hold stretch. Repeat with opposite side.|Basic|https://www.rocketdogrescue.org/wp-content/uploads/2016/08/dog-working-out.jpg|False
Lever Lying Hip Extension (plate loaded)|Glute|Gluteus Maximus|Lever (plate loaded)|Lie on bench with knees legs over pads. Align hip joints with lever fulcrum. Strap hips down with belt. Grasp handles at each side.Extend hips and knees until legs are straight. Return to original position by flexing hips and knees. Repeat.|Basic|https://www.rocketdogrescue.org/wp-content/uploads/2016/08/dog-working-out.jpg|False
Trap Bar Straight Leg Deadlift|Low Back|Erector Spinae|Barbell|Stand on platform under loaded trap bar. Squat down and grasp handles to sides.With knees straight, lower bar down by bending hips. After hips can no longer flex, bend waist as weights approach floor. Hands should be lowered near sides of ankles. Set weight on floor. Lift bar by extending waist and hip until standing upright. Pull shoulders back slightly if rounded. Repeat.|Basic|https://www.rocketdogrescue.org/wp-content/uploads/2016/08/dog-working-out.jpg|False
Trap Bar Deadlift|Glute|Gluteus Maximus|Barbell|Stand with feet shoulder width or narrower in trap bar, weight to each side. Squat down with feet flat and grasp handles to sides.Lift bar by extending hips and knees to full extension. Pull shoulders back at top of lift if rounded. Return weight to floor by bending hips back while allowing knees to bend forward slightly, keeping back straight and knees pointed same direction as feet. Repeat.|Basic|https://www.rocketdogrescue.org/wp-content/uploads/2016/08/dog-working-out.jpg|False
Fixed Bar Side Deltoid Stretch|Side Delt|Deltoid, Lateral|Stretch|Face stationary bar. Grasp stationary bar with one hand approximately chest height. Rotate body so upper arm is positioned across chest.Turn body into upper arm. Hold stretch. Repeat with opposite arm.|Basic|https://www.rocketdogrescue.org/wp-content/uploads/2016/08/dog-working-out.jpg|False
Lever Seated Low Row (plate loaded)|Back|Trapezius, Middle|Seated Rows (Others)|Sit on seat and position chest against pad. Grasp lever handles with overhand/neutral grip.Pull levers back until elbows are behind back and shoulders are pulled back. Return until arms are extended and shoulders are stretched forward. Repeat.|Basic|https://www.rocketdogrescue.org/wp-content/uploads/2016/08/dog-working-out.jpg|False
Dumbbell Alternating Incline Front Raise|Front Delt|Deltoid, Anterior|Dumbbell|Grasp dumbbells and lie supine on upper portion of 45 degree incline bench with legs straight. Position dumbbells downward below each shoulder.With elbows straight or slightly bent, raise one dumbbell forward, up and over shoulder until upper arm is vertical. Lower dumbbell down to starting position. Repeat raise with other arm, alternating between sides.|Basic|https://www.rocketdogrescue.org/wp-content/uploads/2016/08/dog-working-out.jpg|False
Half Squat|Glute|Gluteus Maximus|Body Weight|Stand with arms extended forward.Squat down by bending hips back while allowing knees to bend forward, keeping back straight and knees pointed same direction as feet. Descend to height which allows prescribed number of reps at suggested intensity, short of thighs descending just past parallel to floor. Stand up by extending knees and hips until legs are straight. Return to standing position and repeat.|Basic|https://www.rocketdogrescue.org/wp-content/uploads/2016/08/dog-working-out.jpg|False
Smith Single Leg Squat|Glute|Gluteus Maximus|Smith|ctionsWith bar upper chest height, position bar on back of shoulders and grasp bar to sides. Place feet slightly forward and cross lower leg above knee of supporting leg. Disengage bar by rotating bar back.Bend knee slightly forward while allowing hips to bend, keeping back straight and knee pointed same direction of foot. Descend until thigh of supporting leg is just past parallel to floor. Extend knee and hip until leg is straight. Return and repeat.|Basic|https://www.rocketdogrescue.org/wp-content/uploads/2016/08/dog-working-out.jpg|False
Lever Single Leg 45° Leg Press|Quads|Quadriceps|Leg Presses|Sit on machine with back on padded support. Place one foot mid height to low on platform. Place outside of resting foot on lower surface with knee positioned out for greater clearance. Push platform up by extending hip and knee. Release dock lever and grasp handles to sides.Lower platform by bending leg until knee is just short of complete flexion. Return by extending knee and hip. Repeat. Continue with opposite leg.|Basic|https://www.rocketdogrescue.org/wp-content/uploads/2016/08/dog-working-out.jpg|False
Barbell Hip Thrust|Glute|Gluteus Maximus|Barbell|Sit on floor with long side of bench behind back. Roll barbell back and center over hips. Position upper back on corner of bench. Place feet on floor approximately shoulder width with knees bent. Grasp bar to each side.Raise bar upward by extending hips until straight. Lower and repeat.|Basic|https://www.rocketdogrescue.org/wp-content/uploads/2016/08/dog-working-out.jpg|False
Sled 45° Leg Press|Quads|Quadriceps|Leg Presses|Sit on machine with back on padded support. Place feet on platform. Extend hips and knees. Release dock lever and grasp handles to sides.Lower sled by flexing hips and knees until knees are just short of complete flexion. Return by extending knees and hips. Repeat.|Basic|https://www.rocketdogrescue.org/wp-content/uploads/2016/08/dog-working-out.jpg|False
Lever Hip Flexion|Hip Flexors|Iliopsoas|Lever|Stand on platform facing to one side and grasp bar for support. Position front of leg nearest to machine against padded roller while standing on other leg.Raise lever by flexing hip until knee is higher than hip. Return until hip is extended. Repeat. Continue with opposite leg.|Basic|https://www.rocketdogrescue.org/wp-content/uploads/2016/08/dog-working-out.jpg|False
Weighted Twisting Sit-up|Obliques|Obliques|Twisting Sit-ups|Place feet under low overhanging stationary object. Lie supine on floor or mat with hips and knees bent. Hold plate behind neck with both hands.Flex and twist waist to one direction while raising torso from bench by bending hips. Return until back of shoulders contact floor or mat. Repeat to opposite side alternating twists.|Basic|https://www.rocketdogrescue.org/wp-content/uploads/2016/08/dog-working-out.jpg|False
Lever Lying Leg-Hip Raise|Abs|Rectus Abdominis|Lever (selectorized)|Lie supine on machine with lower legs between padded bars. Grasp handles on each side.Pull lower leg bar up by flexing hips toward arms by flexing hips then waist. Continue to raise knees toward shoulders by flexing waist, raising hips from board. Return until waist and hips are extended down to original position. Repeat.|Basic|https://www.rocketdogrescue.org/wp-content/uploads/2016/08/dog-working-out.jpg|False
Barbell Alternating Lunge & Rear Lunge|Glute|Gluteus Maximus|Barbell|Stand facing rack with barbell at upper chest height and short platform behind. Position bar on back of shoulders and grasp barbell to sides. Dismount bar from rack and step back. Stand with feet slightly narrower than shoulder width apart.Lunge forward with right leg. Land on heel, then forefoot. Lower body by flexing knee and hip of right front leg until knee of rear left leg is almost in contact with floor. Forcibly extending hip and knee of forward right leg to return to original standing position.Step back with right leg while bending supporting left leg. Plant right forefoot far back on floor. Lower body by flexing knee and hip of supporting left leg until knee of rear right leg is almost in contact with floor. Return to original standing position by extending hip and knee of supporting left leg and return rear right leg next to supporting leg. Repeat movement with opposite legs alternating between sides.|Basic|https://www.rocketdogrescue.org/wp-content/uploads/2016/08/dog-working-out.jpg|False
Dumbbell Shoulder Internal Rotation (on floor)|Internal Rotators|Subscapularis|Dumbbell|Hold dumbbell in one hand. Lie on mat with dumbbell in hand. Position upper arm on mat close to body. Bend elbow approximately 90° with dumbbell held upright above elbow.Maintaining 90° bend in elbow, lower dumbbell toward floor until slight stretch is felt in shoulder. Lift dumbbell toward body by internally rotating shoulder until forearm is vertical and repeat. Continue with opposite arm.|Basic|https://www.rocketdogrescue.org/wp-content/uploads/2016/08/dog-working-out.jpg|False
Seated Glute Stretch (chair)|Glute|Gluteus Maximus|Seated|Sit on chair or bench with ankles positioned below knees. Cross lower leg over thigh of opposite leg.Lean down, lowering torso toward thighs. Hold stretch. Repeat with opposite leg.|Basic|https://www.rocketdogrescue.org/wp-content/uploads/2016/08/dog-working-out.jpg|False
Sled Hack Calf Press|Calf|Gastrocnemius|Sled|Lie supine on sled with shoulders against pad and place feet on platform. Grasp handles to sides and straighten knees. Place toes and balls of feet on lower portion of platform with heels and arches extending off.Push sled up away from platform by extending ankles as far as possible. Return by bending ankles until calves are stretched. Repeat.|Basic|https://www.rocketdogrescue.org/wp-content/uploads/2016/08/dog-working-out.jpg|False
Lever Alternating Bent-over Leg Curl|Hamstrings|Hamstrings|Lever (selectorized)|Stand in machine with lower pads behind lower legs, upper pads in front of thighs, and lever fulcrum between knees. Bend over, placing forearms on pads, and grasp handles.Raise left foot slightly off of floor or platform. Raise lever up with left leg, bending knee as high as possible. Return lever until knee is straight. Shift body weight to left foot and raise right foot slightly off of floor or platform. Raise lever up with right leg, bending knee as high as possible. Continue alternating movement between legs.|Basic|https://www.rocketdogrescue.org/wp-content/uploads/2016/08/dog-working-out.jpg|False
Dumbbell Standing Calf Raise|Calf|Gastrocnemius|Dumbbell|Grasp dumbbell in one hand to side. Position toes and balls of feet on calf block with arches and heels extending off. Place hand on support for balance.Raise heels by extending ankles as high as possible. Lower heels by bending ankles until calves are stretched. Repeat.|Basic|https://www.rocketdogrescue.org/wp-content/uploads/2016/08/dog-working-out.jpg|False
Cable Lying Leg-Hip Raise|Abs|Rectus Abdominis|Cable|Attach cable ankle straps to both ankles then attach ankle straps to cable. Lie supine on floor or mat, back far enough so cable is taut. Grasp support behind head.Raise legs by flexing hips while flexing knees until hips are fully flexed. Raise hips from floor by flexing waist. Return until waist, hips and knees are extended downward. Repeat.|Basic|https://www.rocketdogrescue.org/wp-content/uploads/2016/08/dog-working-out.jpg|False
PNF Seated Glute Stretch|Glute|Gluteus Maximus|Seated|Instruct participant to sit on floor or mat, reclining back with support of both arms behind body, and feet on floor and knees bent. Have them cross their lower leg (just above ankle) over thigh of opposite leg. Position chest on participant's back and grasp participant's lower knee and upper ankle.Push participant's torso toward legs. Hold stretch. Repeat with legs in opposite position|Basic|https://www.rocketdogrescue.org/wp-content/uploads/2016/08/dog-working-out.jpg|False
