Cambered Barbell Lying Row|Back|Trapezius, Middle|Barbell|Lie chest down on elevated bench. Grasp cambered barbell below with overhand grip.Pull bar to upper waist or lower chest. Return until arms are extended and shoulders are stretched downward. Repeat.|Basic|https://www.rocketdogrescue.org/wp-content/uploads/2016/08/dog-working-out.jpg|False
Barbell Deadlift|Low Back|Latissmus Dorsi|Barbell|With feet flat beneath bar, squat down and grasp bar with shoulder width or slightly wider overhand or mixed grip.Lift bar by extending hips and knees to full extension. Pull shoulders back at top of lift if rounded. Return and repeat.|Basic|https://www.rocketdogrescue.org/wp-content/uploads/2016/08/dog-working-out.jpg|False
Cable Neck Flexion (with belt)|Neck|Sternocleidomastoid|Cable|Attach belt on low pulley cable by attaching carabiner on belt buckle. Grasp attached belt, face away from pulley, and place head in belt loop. With belt above ears, clamp belt snugly around head by tightly gripping ends close to back of mid-head. With neck braced and assistance of arm, lunge forward to angle torso forward with feet staggered. Place hand on lower thigh for support.Pull head forward and down by flexing neck until chin touches upper chest. Return by hyperextending neck until head is angled upward. Repeat.|Basic|https://www.rocketdogrescue.org/wp-content/uploads/2016/08/dog-working-out.jpg|False
Straight Arm Chest Stretch|Chest|Pectoralis Major, Sternal|Stretch|With arm extended, position hand on fixed structure shoulder height.Turn body away from positioned arm. Hold stretch. Repeat with opposite arm.|Basic|https://www.rocketdogrescue.org/wp-content/uploads/2016/08/dog-working-out.jpg|False
Hyperextension (hands on head)|Low Back|Splenius|Bodyweight|Position thighs prone on large pad and lower legs under padded brace. Place hands behind neck or to sides of head.Raise upper body until hips and waist are extended. Lower body by bending hips and waist until mild stretch is felt or torso is vertical. Repeat.|Basic|https://www.rocketdogrescue.org/wp-content/uploads/2016/08/dog-working-out.jpg|False
Dumbbell Upright Row|Side Delt|Deltoid, Lateral|Dumbbell|Grasp dumbbells and stand with palms facing front of thighs.Pull dumbbells to front of shoulder with elbows leading out to sides. Allow wrists to flex as dumbbells rise upward. Lower and repeat.|Basic|https://www.rocketdogrescue.org/wp-content/uploads/2016/08/dog-working-out.jpg|False
Twisting Crunch (on stability ball)|Obliques|Obliques|Twisting Crunches|Sit on exercise ball. Walk forward on ball and lie back on ball with shoulders and head hanging off, and knees and hips bent. Gently hyperextend back to contour of ball. Hold plate behind neck or on chest with both hands or use no weight.Flex waist to raise upper torso. Return to original position. Repeat.|Basic|https://www.rocketdogrescue.org/wp-content/uploads/2016/08/dog-working-out.jpg|False
Sled Seated Calf Press|Calf|Gastrocnemius|Sled|Place seat away from platform. Sit on seat and place feet on platform. Grasp handles to sides and extend hips and knees. Place toes and balls of feet on lower portion of platform with heels and arches extending off.Push sled by extending ankles as far as possible. Return by bending ankles until calves are stretched. Repeat.|Basic|https://www.rocketdogrescue.org/wp-content/uploads/2016/08/dog-working-out.jpg|False
Trap Bar Straight Leg Deadlift|Hamstrings|Hamstrings|Barbell|Stand on platform under loaded trap bar. Squat down and grasp handles to sides.With knees straight, lower bar down by bending hips. After hips can no longer flex, bend waist as weights approach foor. Hands should be lowered near sides of ankles. Set weight on floor. Lift bar by extending waist and hip until standing upright. Pull shoulders back slightly if rounded. Repeat.|Basic|https://www.rocketdogrescue.org/wp-content/uploads/2016/08/dog-working-out.jpg|False
Lever Alternating Kneeling Hip Extension|Glute|Gluteus Maximus|Hip Extensions|Kneel on lowest (shin) pad with roller pad behind lower thighs. Position midsection on middle pad. Place forearms on padded arm rest and grip handles.Keeping one leg on shin pad, extending hip of other leg and push roller pad back. Raise roller pad up until hip is completely extended. Return leg to original position. Repeat with opposite leg. Continue alternating between each side.|Basic|https://www.rocketdogrescue.org/wp-content/uploads/2016/08/dog-working-out.jpg|False
Lever Shoulder Internal Rotation (plate loaded)|Internal Rotators|Wrist Flexors|Lever (plate loaded)|Lie supine on section of bench furthest away from pads to each side. Position body so shoulders and elbows are aligned to fulcrum on each side. Place wrists or hands on under lower set of pads to each side of head.Pull lever arms upward and toward each side of torso as far as possible by simultaneously rotating upper arms. Lower lever arms to original position and repeat.|Basic|https://www.rocketdogrescue.org/wp-content/uploads/2016/08/dog-working-out.jpg|False
Lever Preacher Curl (arms high)|Brachialis|Brachialis|Lever (selectorized)|Sit on curl machine. Grasp lever handles with underhand grip. Align elbows at same pivot point as fulcrum of lever while placing back of arms up on pads.Pull lever handles toward shoulders. Return handles until arms are fully extended. Repeat.|Basic|https://www.rocketdogrescue.org/wp-content/uploads/2016/08/dog-working-out.jpg|False
Lever One Arm Standing Row (plate loaded)|Back|Trapezius, Middle|Lever (plate loaded)|Place hand on support bar and grasp lever far forward. Place foot on side of moving arm on foot support and position opposite foot behind.Pull lever to side while twisting torso toward opposite side. Pull shoulder back and push chest forward during contraction. Return until arm is extended and torso is pulled toward original direction. Repeat. Continue with opposite arm.|Basic|https://www.rocketdogrescue.org/wp-content/uploads/2016/08/dog-working-out.jpg|False
Barbell Incline Bench Press|Upper Chest|Pectoralis Major, Clavicular|Barbell|Lie supine on incline bench. Dismount barbell from rack over upper chest using wide oblique overhand grip.Lower weight to upper chest. Press bar until arms are extended. Repeat.|Basic|https://www.rocketdogrescue.org/wp-content/uploads/2016/08/dog-working-out.jpg|False
Cable Parallel Grip Pull-up|Lats|Latissimus Dorsi|Pullup/Chinup|Place dip belt around waist. Kneel as close as possible to low pulley or lever and attach hook to dip belt in front between legs. Step up and grasp parallel bars with hands facing inward. Lift legs off of steps or floor.Pull body up until elbow are to sides. Lower body until arms and shoulders are fully extended. Repeat.|Basic|https://www.rocketdogrescue.org/wp-content/uploads/2016/08/dog-working-out.jpg|False
Suspended Single Leg Split Squat|Quads|Quadriceps|Suspended|Grasp one or both suspension trainer handle(s) in lower position. Step and face away from suspension trainers. Balance on one leg while raising foot from behind and slipping single foot in loop(s). Release handle with hand and position leg back so it is supported behind body by suspension trainer. Place hands on hips and maintain balance throughout exercise.Squat down by flexing knee and hip of front leg until knee of rear leg is almost in contact with floor. Return to original standing position by extending hip and knee of forward leg and repeat. Continue with opposite leg.|Basic|https://www.rocketdogrescue.org/wp-content/uploads/2016/08/dog-working-out.jpg|False
Lever Calf Extension (bilateral)|Calf|Quadriceps|Lever (selectorized)|Sit on seat and position forefeet on lever platform or foot pedals. Grasp handles to sides and straighten knees.Push lever by extending ankles as far as possible. Return by bending ankles until calves are stretched. Repeat.|Basic|https://www.rocketdogrescue.org/wp-content/uploads/2016/08/dog-working-out.jpg|False
Sit-up|Abs|Rectus Abdominis|Sit-ups|Hook feet under foot brace or secure low overhang. Lie supine on floor or bench with hips bent. Place hands behind neck or on side of neck.Raise torso from bench by bending waist and hips. Return until back of shoulders contact incline board. Repeat.instead of foot bar. Certain individuals may need to keep their neck in neutral position with space between their chin and sternum. If upper back does not come completely down at end of movement, abdominal muscles may only be|Basic|https://www.rocketdogrescue.org/wp-content/uploads/2016/08/dog-working-out.jpg|False
Barbell Push Crunch|Abs|Rectus Abdominis|Barbell|Position feet under foot pad and lie supine on steep incline bench. Pull barbell from floor or grasp from rack behind with overhand grip. Position barbell over chest with shoulder width or slightly wider grip.Flex waist to raise upper torso from bench, keeping low back on bench. Return until back of shoulders contact padded incline board. Repeat.|Basic|https://www.rocketdogrescue.org/wp-content/uploads/2016/08/dog-working-out.jpg|False
Lever Shrug (plate loaded)|Traps|Trapezius, Upper|Lever (plate loaded)|Stand between lever handles to sides. Squat down with feet flat on floor and grasp upper handles to sides. Stand upright by extending hips and knees to full extension.Elevate shoulders as high as possible. Lower and repeat.|Basic|https://www.rocketdogrescue.org/wp-content/uploads/2016/08/dog-working-out.jpg|False
Smith Straight-back Straight-leg Deadlift|Hamstrings|Hamstrings|Smith|Stand with shoulder width or narrower stance with thigh against bar. Grasp bar with shoulder width or slightly wider overhand grip. Disengage bar by rotating bar back.With knees and back straight, lower bar by bending hips until hamstrings are tight, or just before lower back bends. Lift bar by extending hips until straight. Pull shoulders back slightly if rounded. Repeat.|Basic|https://www.rocketdogrescue.org/wp-content/uploads/2016/08/dog-working-out.jpg|False
Cable One Arm Seated Row|Back|Trapezius, Middle|Seated Rows|Sit slightly forward on platform or secured bench in order to grasp cable stirrup with one hand. Position hips back with knees slightly bent   . Allow shoulder with stirrup to be pulled forward.Pull cable attachment to side of torso, slightly twisting through waist. Pull shoulder back and push chest forward during contraction. Return until arm is extended and shoulder is stretched forward. Repeat. Continue with opposite arm.|Basic|https://www.rocketdogrescue.org/wp-content/uploads/2016/08/dog-working-out.jpg|False
Trap Bar Stiff Leg Deadlift|Glute|Gluteus Maximus|Barbell|Stand on platform under loaded trap bar. Squat down and grasp handles to sides.Lower bar by bending hips. Bend knees slightly during descent and keep waist straight, flexing only slightly at bottom. With knees bent, lift bar by extending at hips until standing upright. Pull shoulders back slightly if rounded. Extend knees at top if desired. Repeat.Lower back may bend slightly during full hip flexion. Target muscle is exercised isometrically if lower back does not bend. Begin with light weight and add additional weight gradually to allow adequate|Basic|https://www.rocketdogrescue.org/wp-content/uploads/2016/08/dog-working-out.jpg|False
Lever Seated Groin Stretch|Hip Adductors|Adductors, Hip|Stretch|Sit on apparatus with each leg on adjacent platforms.Separate legs apart by turning knob. Lean forward slightly and grasp forward bar if available. Hold stretch.|Basic|https://www.rocketdogrescue.org/wp-content/uploads/2016/08/dog-working-out.jpg|False
Cable One Arm Standing Cross Row|Rear Delt|Latissimus Dorsi|Cable|Facing shoulder height cable pulley, grasp stirrup cable attachment with one hand, palm orientated down. Step back and turn body inward about 30° to 45° to face extended arm about. Stand back just enough to allow arm to be fully extended with weight raised up slightly.Pull stirrup back with elbow up at shoulder height until elbow travels just behind shoulder. Keep upper arm horizontal, perpendicular to trunk. Return until arm is fully extended. Repeat.|Basic|https://www.rocketdogrescue.org/wp-content/uploads/2016/08/dog-working-out.jpg|False
Lever Seated Leg Press (plate loaded)|Glute|Gluteus Maximus|Leg Presses|Sit on machine with back on padded support. Place feet slightly high on platform. Grasp handles to sides.Push platform(s) away by extending knees and hips until knees are fully extended. Return until hips are completely flexed. Repeat.|Basic|https://www.rocketdogrescue.org/wp-content/uploads/2016/08/dog-working-out.jpg|False
Cable Split Squat (belt)|Quads|Quadriceps|Cable|Facing low pulley, kneel to attach cable belt or dip belt around waist. Place hand(s) on ballet bar or machine (not on guide rod!) for balance. Stand away from pulley with one leg forward and opposite leg to rear.Squat down by flexing knee and hip of front leg. Allow heel of rear foot to rise up while knee of rear leg bends slightly, until it almost makes contact with floor. Return to original straddle position by extending hip and knee of forward leg. Repeat. Continue with legs in opposite position.|Basic|https://www.rocketdogrescue.org/wp-content/uploads/2016/08/dog-working-out.jpg|False
PNF Seated Biceps Stretch|Biceps|Biceps Brachii|Stretch|Instruct participant to sit on floor or bench and place arms to behind hips. From behind, grasp participant's wrists, positioning them downward and close together.Continue to raise participant's arms upward behind their body. Hold stretch.|Basic|https://www.rocketdogrescue.org/wp-content/uploads/2016/08/dog-working-out.jpg|False
Lever Single Leg Standing Leg Press (plate loaded)|Quads|Quadriceps|Leg Presses|Step on left platform with left foot. Grasp handle bars to each side. Place right foot on highest lever platform.Push platform down by extending hip and knee until straight. Return leg to original position. Repeat. Continue with opposite leg positions.|Basic|https://www.rocketdogrescue.org/wp-content/uploads/2016/08/dog-working-out.jpg|False
Barbell Hyperextension|Low Back|Erector Spinae|Barbell|Position thighs prone on large pad and lower legs under padded brace. Place barbell on back of shoulders and grasp bar to sides.Raise upper body until hips and waist are fully extended. Lower body by bending hips and waist until mild stretch is felt or torso is vertical. Repeat.|Basic|https://www.rocketdogrescue.org/wp-content/uploads/2016/08/dog-working-out.jpg|False
Lever Barbell Split Squat (plate loaded)|Glute|Gluteus Maximus|Lever (plate loaded)|With bar upper chest height, position bar on back of shoulders and grasp bar to sides. Place one foot forward and forefoot of other leg further back. Disengage bar by rotating bar back.Lower body on other leg by flexing knees and hips of of both legs until knee of rear leg is almost in contact with floor. Return to original straddled position by extending hips and knees of both legs. Repeat. Continue with opposite leg.|Basic|https://www.rocketdogrescue.org/wp-content/uploads/2016/08/dog-working-out.jpg|False
Lever Bench Press|Chest|Pectoralis Major, Sternal|Presses|Lie supine on bench with chest under lever bar. Grasp lever bar with wide oblique overhand grip.Press bar until arms are extended. Lower weight to upp   er chest. Repeat.|Basic|https://www.rocketdogrescue.org/wp-content/uploads/2016/08/dog-working-out.jpg|False
Dumbbell Incline Fly|Upper Chest|Pectoralis Major, Clavicular|Dumbbell|Grasp two dumbbells. Lie supine on bench. Support dumbbells above upper chest with arms fixed in slightly bent position. Bend elbows slightly and internally rotate shoulders so elbows point out to sides.Lower dumbbells outward to sides of shoulders. Keep elbows fixed in slightly bent position. When a stretch is felt in chest or shoulders, bring dumbbells back together in hugging motion above upper chest until dumbbells are nearly together. Repeat.|Basic|https://www.rocketdogrescue.org/wp-content/uploads/2016/08/dog-working-out.jpg|False
Lever Alternating Single Leg Split V-Squat|Glute|Gluteus Maximus|Lever (selectorized)|Position shoulders under shoulder pads with back against back pad. Place feet slightly forward on platform. Squeeze hand lever. Keeping hand lever squeezed, squat down by bending hips and knees until hip or knee is short of complete flexion. Release hand lever and raise up on sled just slightly until weight stack is engaged (click is heard). Raise lever by extending knees and hips.Transfer right foot back to inside of rear vertical platform. Lower lever by flexing hips and knees until knee of rear leg is almost in contact with floor. Raise lever by extending knees and hips until knee is straight. Return right foot to original position by other foot. Repeat with opposite leg movement and continue alternating between sides.|Basic|https://www.rocketdogrescue.org/wp-content/uploads/2016/08/dog-working-out.jpg|False
Weighted Incline Sit-up|Abs|Rectus Abdominis|Sit-ups|ctionsHook feet under support and lie supine on incline bench with hips bent. Hold plate behind neck or clasp hands behind neck with no weight.Raise torso from bench by bending waist and hips. Return until back of shoulders contact padded incline board. Repeat.|Basic|https://www.rocketdogrescue.org/wp-content/uploads/2016/08/dog-working-out.jpg|False
Lever V-Squat (plate loaded)|Glute|Gluteus Maximus|Lever (plate loaded)|Position shoulders under shoulder pads with back against back pad. Place feet on platform, shoulder or hip width apart. Extend hips and knees and release lever if available.Bend knees forward slightly while allowing hips to bend back behind, keeping back straight and knees pointed same direction as feet. Descend until hips are just short of complete flexion. Raise sled by extending knees and hips. Repeat.|Basic|https://www.rocketdogrescue.org/wp-content/uploads/2016/08/dog-working-out.jpg|False
Lever Lying Leg Raise Crunch (plate loaded)|Abs|Rectus Abdominis|Lever (plate loaded)|Lie supine on machine with lower legs between padded bars. Grasp handles on each side.Pull handles toward legs while pulling lower leg bar toward arms by flexing waist and hips. Return and repeat.|Basic|https://www.rocketdogrescue.org/wp-content/uploads/2016/08/dog-working-out.jpg|False
Incline Crunch|Abs|Rectus Abdominis|Body Weight|Hook feet under foot brace and lie supine on incline board with hips bent. Place hands behind neck or head.Flex waist to raise upper torso from bench. Keep low back on bench and raise torso up as high as possible. Return until back of shoulders contact incline board. Repeat.|Basic|https://www.rocketdogrescue.org/wp-content/uploads/2016/08/dog-working-out.jpg|False
Weighted Neutral Grip Chin-up|Lats|Latissimus Dorsi|Weighted|Reach up and grasp bars angled inward with underhand shoulder width grip.Pull body up until elbows are to sides. Lower body until arms and shoulders are fully extended. Repeat.|Basic|https://www.rocketdogrescue.org/wp-content/uploads/2016/08/dog-working-out.jpg|False
Lever Triceps Dip|Triceps|Triceps Brachii|Lever (selectorized)|If possible, place handles in narrow position. Sit on seat with back against pad. Grasp handles and position elbows back.Push levers down by straightening arms downward. Allow lever bar to raise with elbows pointing back until shoulders are slightly stretched. Repeat.|Basic|https://www.rocketdogrescue.org/wp-content/uploads/2016/08/dog-working-out.jpg|False
Barbell Block Pull|Low Back|Latissmus Dorsi|Barbell|With barbell on blocks, position feet shoulder width or slightly narrower beneath bar. Squat down and grasp bar with shoulder width or slightly wider overhand or mixed grip.Lift bar by extending hips and knees to full extension. Pull shoulders back at top of lift if rounded. Return and repeat.|Basic|https://www.rocketdogrescue.org/wp-content/uploads/2016/08/dog-working-out.jpg|False
Kneeling Wrist Flexor Stretch|Wrist Flexors|Wrist Flexors|Stretch|Kneel on floor or mat. Place palms of hand on floor with fingers pointing toward knees.Shift body back with elbows straight. Hold stretch.|Basic|https://www.rocketdogrescue.org/wp-content/uploads/2016/08/dog-working-out.jpg|False
Cable Step-up|Quads|Quadriceps|Cable|Stand behind elevated platform and low and close pulley cables to sides. Grasp stirrups at each side of platform. Stand upright with arms straight down at sides.Place foot of first leg on elevated platform. Stand on elevated platform by extending hip and knee of first leg and place foot of second leg on bench. Step down with second leg by flexing hip and knee of first leg. Return to original standing position by placing foot of first leg to lower position. Repeat first step with opposite leg, alternating first steps between legs.|Basic|https://www.rocketdogrescue.org/wp-content/uploads/2016/08/dog-working-out.jpg|False
Dumbbell Single Leg Calf Raise|Calf|Gastrocnemius|Dumbbell|Grasp dumbbell in one hand to side. Position toes and balls of feet on calf block with arches and heels extending off. Place hand on support for balance. Lift other leg to rear by bending knee.Raise heel by extending ankle as high as possible. Lower heel by bending ankle until calf is stretched. Repeat. Continue with opposite leg.|Basic|https://www.rocketdogrescue.org/wp-content/uploads/2016/08/dog-working-out.jpg|False
Cable Standing Preacher Curl|Brachialis|Brachialis|Cable|Stand behind preacher bench. Grasp cable bar with shoulder width underhand grip. Position back of arms on pad.Raise cable bar toward shoulders. Lower cable bar until arms are fully extended. Repeat.|Basic|https://www.rocketdogrescue.org/wp-content/uploads/2016/08/dog-working-out.jpg|False
Lunge|Glute|Gluteus Maximus|Body Weight|Stand with hands on hips or in front of body.Lunge forward with first leg. Land on heel, then forefoot. Lower body by flexing knee and hip of front leg until knee of rear leg is almost in contact with floor. Return to original standing position by forcibly extending hip and knee of forward leg. Repeat by alternating lunge with opposite leg.Weighted versions of this exercise would normally be considered auxiliary in context of other basic exercises (ie: Barbell Squat, Sled Leg Press). However, in the context of 'body weight' only program, this exercise can be considered basic.|Basic|https://www.rocketdogrescue.org/wp-content/uploads/2016/08/dog-working-out.jpg|False
Dumbbell Lying Supination (arm down)|Supinators|Biceps Brachii|Dumbbell|"Grasp unilaterally loaded dumbbell with pinkie finger next to weight side. Lie on bench on side with weight and position arm with ""half dumbbell"" on bench. Bend elbow approximately 90-degrees and tuck bent elbow under body. Position thumb up (pronated).Rotate dumbbell so thumb turns downward (supinated). Return and repeat."|Basic|https://www.rocketdogrescue.org/wp-content/uploads/2016/08/dog-working-out.jpg|False
Barbell Straight Leg Deadlift|Hamstrings|Hamstrings|Barbell|Stand with shoulder width or narrower stance on shallow platform with feet flat beneath bar. Bend knees and bend over with lower back straight. Grasp barbell with shoulder width overhand or mixed grip, shoulder width or slightly wider. Lift weight to standing position.With knees straight, lower bar toward top of feet by bending hips. After hips can no longer flex, bend waist as bar approaches top of feet. Lift bar by extending waist and hip until standing upright. Pull shoulders back slightly if rounded. Repeat.|Basic|https://www.rocketdogrescue.org/wp-content/uploads/2016/08/dog-working-out.jpg|False
Sled One Hand Grip (plate loaded)|Wrist Flexors|Wrist Flexors|Sled (plate loaded)|Bend over and grasp bar grips with one hand; fingers under lower bar and base of thumb over top stationary bar.Squeeze bar grips together until lower bar makes contact with upper bar. Release to original position and repeat.|Basic|https://www.rocketdogrescue.org/wp-content/uploads/2016/08/dog-working-out.jpg|False
Cable Straight Leg Deadlift|Hamstrings|Hamstrings|Cable|Stand between two very low pulleys with shoulder width or narrower stance. Squat down and grasp stirrup attachments to each side. Stand upright with arms straight down to sides.With knees straight, bow forward by bending hips. Bend waist as stirrups approach lowest position. Lift stirrups by extending hips and waist until standing upright. Pull shoulders back slightly if rounded. Repeat.|Basic|https://www.rocketdogrescue.org/wp-content/uploads/2016/08/dog-working-out.jpg|False
Single Leg Reverse Calf Raise|Shin|Tibialis Anterior|Body Weight|Position one heel on forward edge of platform. Grasp support with other hand for balance. Lift other leg to rear by bending knee.Pull forefoot up toward body as far as possible. Return by extending foot until toes are pointed downward. Repeat. Continue with opposite leg.|Basic|https://www.rocketdogrescue.org/wp-content/uploads/2016/08/dog-working-out.jpg|False
Sled Single Leg 45° Calf Press|Calf|Gastrocnemius|Sled|Sit on seat with back on padded support. Place feet on platform. Grasp handles to sides and extend hips and knees. With one foot, place toes and ball of foot on lower portion of platform with heels and arches extending off. Position other foot on floor within machine.Push sled by extending ankle as far as possible. Return by bending ankle until calf is stretched. Repeat.|Basic|https://www.rocketdogrescue.org/wp-content/uploads/2016/08/dog-working-out.jpg|False
