Smith Straight Leg Deadlift|Hamstrings|Hamstrings|Smith|Stand with shoulder width or narrower stance on elevated platform with thigh against bar. Grasp bar with shoulder width or slightly wider overhand grip. Disengage bar by rotating bar back.With knees straight, lower bar toward top of feet by bending hips. After hips can no longer flex, bend waist as bar approaches top of feet. Lift bar by extending waist and hip until standing upright. Pull shoulders back slightly if rounded. Repeat.|Basic|https://www.rocketdogrescue.org/wp-content/uploads/2016/08/dog-working-out.jpg|False
Lever Single Leg Squat (plate loaded)|Glute|Gluteus Maximus|Lever (plate loaded)|Stand between handles facing away from fulcrum. Grasp both handles to sides and stand upright. Cross lower leg above knee of supporting leg.Bend knee forward slightly while allowing hips to bend back behind, keeping back straight and knee pointed same direction of foot. Squat down as low as possible. Extend knee and hip until leg is straight. Return and repeat. Continue with opposite leg.|Basic|https://www.rocketdogrescue.org/wp-content/uploads/2016/08/dog-working-out.jpg|False
Band-assisted Chest Dip|Chest|Pectoralis Major, Sternal|Band-assisted|Place one foot on middle of exercise band with ends looped onLower body by bending arms, allowing elbows to flare out to sides. When slight stretch is felt in chest or shoulders, push body up until arms are straight. Repeat.|Basic|https://www.rocketdogrescue.org/wp-content/uploads/2016/08/dog-working-out.jpg|False
Lever Hip Thrust (on lying leg curl machine)|Glute|Gluteus Maximus|Lever (plate loaded)|Sit on floor facing padded roller with back against edge of thigh pad. Position back of shoulders on thigh pad and hips under padded roller. Place feet on floor or slightly elevated platform approximately shoulder width with knees bent. Place hands on roller pad or postion bend arms above chest.Raise padded roller upward by extending hips until straight. Lower and repeat.|Basic|https://www.rocketdogrescue.org/wp-content/uploads/2016/08/dog-working-out.jpg|False
Lever Incline Bench Press|Upper Chest|Pectoralis Major, Clavicular|Lever (selectorized)|Lie supine on incline bench with upper chest under lever bar. Grasp lever bar with wide oblique overhand grip.Press bar until arms are extended. Lower weight to upper chest. Repeat.|Basic|https://www.rocketdogrescue.org/wp-content/uploads/2016/08/dog-working-out.jpg|False
Weighted Twisting Crunch (on stability ball)|Obliques|Obliques|Twisting Crunches|Sit on exercise ball. Walk forward on ball and lie back on ball with shoulders and head hanging off and knees and hips bent. Gently hyperextend back to contour of ball. Hold plate behind neck or on chest with both hands or use no weight.Flex waist to raise upper torso. Return to original position and repeat.|Basic|https://www.rocketdogrescue.org/wp-content/uploads/2016/08/dog-working-out.jpg|False
Machine-assisted Triceps Dip|Triceps|Triceps Brachii|Assisted|MountLower body until slight stretch is felt in shoulders. Push body up until arms are straight. Repeat.|Basic|https://www.rocketdogrescue.org/wp-content/uploads/2016/08/dog-working-out.jpg|False
Lever Chest Dip (plate loaded)|Chest|Pectoralis Major, Sternal|Lever (plate loaded)|Sit on seat and grasp handles with oblique grip. If possible, place handles inPush lever down with elbows away from body. Return until chest is slightly stretched. Repeat.|Basic|https://www.rocketdogrescue.org/wp-content/uploads/2016/08/dog-working-out.jpg|False
Lying Vertical Hamstring Stretch|Hamstrings|Hamstrings|Stretch|Lie on floor with one leg extending up onto side of wall or column and other leg bent with foot on floor. One way this can be position can be achieved in a single motion is by sitting on floor with back of one shoulder against end of wall or column. Rotate body 90° onto back while swinging one leg up onto side of wall or column, ending up with back on floor and head positioned away from wall.Straighten elevated knee until slight stretch is felt in back of thigh. If no stretch is felt, slowly straighten bent leg until slight stretch is felt in back of thigh. Hold stretch. Repeat with opposite leg on opposite side of wall or column.|Basic|https://www.rocketdogrescue.org/wp-content/uploads/2016/08/dog-working-out.jpg|False
Kneeling Groin Stretch|Hip Adductors|Adductors, Hip|Stretch|Kneel with feet pointed out to sides. Place forearms and hands on floor.Spread knees apart and gently lower hips. Hold stretch for 20 seconds.|Basic|https://www.rocketdogrescue.org/wp-content/uploads/2016/08/dog-working-out.jpg|False
Upper Trapezius Stretch|Traps|Trapezius, Upper|Stretch|Grasp wrist or hand from behind and pull arm to opposite side.Tilt head away from lowered shoulder by positioning ear toward front of opposite shoulder. Hold stretch. Repeat to other side.|Basic|https://www.rocketdogrescue.org/wp-content/uploads/2016/08/dog-working-out.jpg|False
Lever Squat|Glute|Gluteus Maximus|Lever (selectorized)|Squat down to place shoulders under padded lever. Place feet shoulder width apart slightly in front of shoulders.Raise lever up by extending knees and hips until legs are straight. Squat down by bending hips back while allowing knees to bend forward slightly, keeping back straight and knees pointed same direction as feet. Descend until thighs are just past parallel to floor. Return and repeat.|Basic|https://www.rocketdogrescue.org/wp-content/uploads/2016/08/dog-working-out.jpg|False
Lever Single Leg Seated Leg Curl (plate loaded)|Hamstrings|Hamstrings|Lever (plate loaded)|Sit on seat with back against padded back support. Push hand lever to lower leg pads. Place one leg in between pads. Place other leg on top of upper most pad bar. Release hand lever gradually. Grasp handles to sides with each hand.Pull padded lever to back of thighs as far as possible by flexing knee. Return padded lever until knee is straight. Change legs and repeat for opposite leg.|Basic|https://www.rocketdogrescue.org/wp-content/uploads/2016/08/dog-working-out.jpg|False
Lever Chest Press (plate loaded)|Chest|Pectoralis Major, Sternal|Lever (plate loaded)|Sit on seat with chest approximately height of handles. Grasp handles with wide overhand grip; elbows out to sides just below shoulders.Press levers until arms are extended. Return weight until chest muscles are slightly stretched. Repeat.|Basic|https://www.rocketdogrescue.org/wp-content/uploads/2016/08/dog-working-out.jpg|False
Barbell Close Grip Bench Press|Triceps|Triceps Brachii|Barbell|Lie on bench and grasp barbell from rack with shoulder width grip.Lower weight to chest with elbows close to body. Push barbell back up until arms are straight. Repeat.|Basic|https://www.rocketdogrescue.org/wp-content/uploads/2016/08/dog-working-out.jpg|False
Parallel Close Grip Pull-up|Lats|Latissimus Dorsi|Body Weight|Step up and grasp parallel bars.Pull body up until elbow are to sides. Lower body until arms and shoulders are fully extended. Repeat.To decrease difficulty, use assisted version of this exercise.|Basic|https://www.rocketdogrescue.org/wp-content/uploads/2016/08/dog-working-out.jpg|False
Lever Split Squat (plate loaded)|Glute|Gluteus Maximus|Lever (plate loaded)|Stand between lever handles to sides. Place forefoot of one foot on floor to rear and other foot slightly forward. Squat down and grasp handles to sides.With chest high, lift lever by extending hips and knees to full extension. Return until knee of rear leg is almost in contact with floor and repeat. Continue with opposite leg.|Basic|https://www.rocketdogrescue.org/wp-content/uploads/2016/08/dog-working-out.jpg|False
Cable Underhand Pulldown|Lats|Latissimus Dorsi|Cable|Grasp cable bar with underhand grip. Sit with thighs under supports.Pull down cable bar to upper chest until elbows are to sides. Return until arms and shoulders are fully extended. Repeat.|Basic|https://www.rocketdogrescue.org/wp-content/uploads/2016/08/dog-working-out.jpg|False
Overhead Triceps Stretch|Triceps|Triceps, Long Head|Stretch|Put one arm overhead. Position forearm as close as possible to upper arm. Grasp elbow overhead with other hand.Pull elbow back and toward head. Hold stretch. Repeat with opposite arm.|Basic|https://www.rocketdogrescue.org/wp-content/uploads/2016/08/dog-working-out.jpg|False
Side Bend (on stability ball)|Obliques|Obliques|Body Weight|Lie on ball on side of torso, waist, and hip. Position legs outward with feet on floor or against floor board.Raise side of torso up by lateral flexing waist. Lower torso back on ball and repeat. Position other side on ball and repeat with opposite side.|Basic|https://www.rocketdogrescue.org/wp-content/uploads/2016/08/dog-working-out.jpg|False
Lever Rear Delt Raise (plate loaded)|Rear Delt|Deltoid, Posterior|Lever (plate loaded)|Stand between lever handles facing away from machine. Squat down and grasp lever handles to each side. Stand up with arms straight to sides.Pull lever up as far as possible allowing elbows to travel up behind body to each side. Lower until arms are straight and repeat.|Basic|https://www.rocketdogrescue.org/wp-content/uploads/2016/08/dog-working-out.jpg|False
Band-assisted Neutral Grip Chin-up|Lats|Latissimus Dorsi|Band-assisted|Grab each side of hanging exercise band with both hands. Stretch exercise band down and step onto bottom inside of band with one foot. Stretch band down further by extending leg straight down. Reach up and grasp bars angled inward with underhand shoulder width grip while keeping banded leg straight.Pull body up until elbows are to sides. Lower body until arms and shoulders are fully extended. Repeat.|Basic|https://www.rocketdogrescue.org/wp-content/uploads/2016/08/dog-working-out.jpg|False
Barbell Squat (with chains)|Glute|Gluteus Maximus|Barbell|Stand facing barbell, racked upper chest height, with thick chains hanging to floor on each side. Position bar low on back of shoulders. Grasp barbell to sides and position elbows back. Dismount bar from rack and stand with wide stance.Squat down by bending hips back while allowing knees to bend forward slightly, keeping back straight and knees pointed same direction as feet.   Descend until thighs are just past parallel to floor. Extend hips and knees until legs are straight. Return and repeat.|Basic|https://www.rocketdogrescue.org/wp-content/uploads/2016/08/dog-working-out.jpg|False
Cable Kneeling Triceps Extension|Triceps|Triceps Brachii|Cable|Grasp cable bar from middle pulley with narrow or shoulder width overhand grip. Turn body away from pulley apparatus with cable bar above head. Kneel before bench, bend over and place elbows on edge of bench. Maintain upper arms parallel with shoulders as low as possible.Extend forearms over head until elbow are fully extended. Return and repeat.|Basic|https://www.rocketdogrescue.org/wp-content/uploads/2016/08/dog-working-out.jpg|False
Incline Twisting Sit-up (arms crossed)|Obliques|Obliques|Twisting Sit-ups|Hook feet under foot or ankle brace and lie supine on incline bench with hips and knees bent. Cross arms on chest.Flex and twist waist to one direction while raising torso from bench by bending hips. Raise crossed arm over opposite knees at top. Return until back of shoulders contact padded incline board. Repeat to opposite side alternating twists.|Basic|https://www.rocketdogrescue.org/wp-content/uploads/2016/08/dog-working-out.jpg|False
Sled Grip (plate loaded)|Wrist Flexors|Wrist Flexors|Sled (plate loaded)|Bend over and grasp bar grips with both hands; fingers under lower bar and base of thumbs over top stationary bar.Squeeze bar grips together until lower bar makes contact with upper bar. Release to original position and repeat.|Basic|https://www.rocketdogrescue.org/wp-content/uploads/2016/08/dog-working-out.jpg|False
Lever Narrow Grip Shrug (plate loaded)|Traps|Trapezius, Upper|Lever (plate loaded)|Stand very near to close lever handles. Bend over and grasp handles with each hand. Stand upright.Elevate shoulders as high as possible. Lower and repeat.|Basic|https://www.rocketdogrescue.org/wp-content/uploads/2016/08/dog-working-out.jpg|False
Weighted Donkey Calf Raise|Calf|Gastrocnemius|Weighted|Stand on edge of platform, toes and balls of feet on calf block with arches and heels extending off. Bend over and grasp knee high bar (as shown) or place forearms on thigh high surface (seeRaise heels by extending ankles as high as possible. Lower heels by bending ankles until calves are stretched. Repeat.|Basic|https://www.rocketdogrescue.org/wp-content/uploads/2016/08/dog-working-out.jpg|False
Lever Lying Leg Press (plate loaded)|Quads|Quadriceps|Leg Presses|Climb up steps to top of machine. Lie supine on horizontal padded platform with shoulders against pad. Place feet equally spaced on platform. Grip handles above shoulder pads.Push lever platform away by extending hips and knees until knees are straight. Return lever platform by flexing hips and knees until knees are just short of complete flexion or until hips are completely flexed. Repeat.|Basic|https://www.rocketdogrescue.org/wp-content/uploads/2016/08/dog-working-out.jpg|False
Cable Seated Lateral Raise|Side Delt|Deltoid, Lateral|Cable|Sit on seat above twin cable pulleys. Grasp stirrups on each side. Sit upright with arms nearly straight down to each side.With elbows slightly bent, raise arms to side until elbows are shoulder height. Lower and repeat.|Basic|https://www.rocketdogrescue.org/wp-content/uploads/2016/08/dog-working-out.jpg|False
Dumbbell Split Squat|Quads|Quadriceps|Dumbbell|Stand with dumbbells grasped to sides. Position feet far apart; one foot forward and other foot behind.Squat down by flexing knee and hip of front leg. Allow heel of rear foot to rise up while knee of rear leg bends slightly until it almost makes contact with floor. Return to original standing position by extending hip and knee of forward leg. Repeat. Continue with opposite leg.|Basic|https://www.rocketdogrescue.org/wp-content/uploads/2016/08/dog-working-out.jpg|False
Vertical Leg-Hip Raise|Abs|Rectus Abdominis|Leg-Hip Raises|Position forearms on padded parallel bars with hands on handles, and back on vertical pad.Raise legs by flexing hips and knees until hips are fully flexed. Continue to raise knees toward shoulders by flexing waist, raising hips from back board. Return until waist, hips, and knees are extended. Repeat.Rectus Abdominis and Obliques|Basic|https://www.rocketdogrescue.org/wp-content/uploads/2016/08/dog-working-out.jpg|False
Smith Close Grip Incline Bench Press|Triceps|Triceps Brachii|Smith|Lie on incline bench with bar above chest and grasp bar with shoulder width or slightly narrower grip. Disengage bar by rotating bar back.Lower weight to chest with elbows close to body. Push bar back up until arms are straight. Repeat.|Basic|https://www.rocketdogrescue.org/wp-content/uploads/2016/08/dog-working-out.jpg|False
Lever T-bar Row (plate loaded)|Back|Trapezius, Middle|Lever (plate loaded)|Bend knees slightly and bend over lever handles with back straight. Grasp lever handles with shoulder width to wide overhand grip.Pull lever up to torso. Return until arms are extended and shoulders are stretched downward. Repeat.Position torso as low as possible, allowing for full arm extension. Keep low back straight. Lighten load if torso raises beyond 45 degrees in order to complete repetition. See|Basic|https://www.rocketdogrescue.org/wp-content/uploads/2016/08/dog-working-out.jpg|False
Doorway Chest Stretch|Chest|Pectoralis Major, Sternal|Stretch|Stand at end of wall or in doorway facing perpendicular to wall. Place inside of bent arm on surface of wall. Position bent elbow shoulder height.Turn body away from positioned arm. Hold stretch. Repeat with opposite arm.|Basic|https://www.rocketdogrescue.org/wp-content/uploads/2016/08/dog-working-out.jpg|False
Lever Lying Fly|Chest|Pectoralis Major, Sternal|Flies|Lie supine on bench. Position both arms under padded levers. Slightly bend elbows and internally rotate shoulders so elbows are back.Bring padded levers upward and together in hugging motion. Return to starting position until chest muscles are stretched. Repeat.|Basic|https://www.rocketdogrescue.org/wp-content/uploads/2016/08/dog-working-out.jpg|False
Dumbbell Lying Supination|Supinators|Biceps Brachii|Dumbbell|Lie on bench or mat. With hand of upper arm, grasp unilaterally loaded dumbbell; thumb next to side with weight. Bend elbow approximately 90-degrees and place forearm on hip, or side of waist. Position thumb downward (pronated).Rotate dumbbell so thumb turns upward (supination). Return and repeat.|Basic|https://www.rocketdogrescue.org/wp-content/uploads/2016/08/dog-working-out.jpg|False
Cable Straight Back Incline Row|Back|Trapezius, Middle|Cable|Sit on incline and place feet on lower bar, or foot platform. Slide hips down by bending knees. Bend over and grasp cable attachment. Slide hips back, positioning knees with slight bend. Straighten lower back so it is approximately perpendicular to incline.Pull cable attachment to waist. Pull shoulders back and lift chest by arching back. Return until arms are extended, back is straight and perpendicular to incline, and shoulders are stretched forward. Repeat.|Basic|https://www.rocketdogrescue.org/wp-content/uploads/2016/08/dog-working-out.jpg|False
Standing Hip Flexor Stretch|Hip Flexors|Iliopsoas|Stretch|Stand facing bench or elevated platform, approximately legs length away. Place one foot on bench or platform.Slowly lunge forward by bending forward leg. With chest high, straighten hip of rear leg by pushing hips forward. Hold stretch. Repeat with opposite side.|Basic|https://www.rocketdogrescue.org/wp-content/uploads/2016/08/dog-working-out.jpg|False
Lever Seated Reverse Calf Press|Shin|Tibialis Anterior|Lever (selectorized)|Place seat away from platform. Sit on seat with lower back against padding and place feet very high on platform. Grasp handles to sides and straighten knees.Pull forefoot back toward body as far as possible while pushing platform with heels. Return feet down to platform and repeat.|Basic|https://www.rocketdogrescue.org/wp-content/uploads/2016/08/dog-working-out.jpg|False
Self-assisted Single Leg Squat (leg wrapped)|Quads|Quadriceps|Self-assisted|Place hand on waist high prop or other tall, sturdy structure for support. Stand on one leg by wrapping leg around back of supporting leg so top of lifted foot is on outside of supporting leg's ankle.Squat down by bending knee forward and hip back behind. Keep back straight and supporting knee pointed same direction as foot supporting. Descend until thigh is just past parallel to floor. Return to standing position with minimal assistance from wrapped leg. Stand to original position until knee and hip of supporting leg are straight. Return and repeat. Continue with opposite leg.|Basic|https://www.rocketdogrescue.org/wp-content/uploads/2016/08/dog-working-out.jpg|False
Dumbbell Wrist Curl|Wrist Flexors|Wrist Flexors|Dumbbell|Sit and grasp dumbbell with underhand grip. Rest forearm on thigh with wrist just beyond knee.Allow dumbbell to roll out of palm down to fingers. Raise dumbbell back up by gripping and pointing knuckles up as high as possible. Lower and repeat.|Basic|https://www.rocketdogrescue.org/wp-content/uploads/2016/08/dog-working-out.jpg|False
Cable Seated Curl|Biceps|Biceps Brachii|Cable|Sit on seat situated between two low pulleys down to each side. Grasp stirrups in each hand, palms facing forward.Pull both stirrups up toward shoulders while keeping elbows stationary. Return until arms are fully extended and repeat.|Basic|https://www.rocketdogrescue.org/wp-content/uploads/2016/08/dog-working-out.jpg|False
Barbell Bench Press (with chains)|Chest|Pectoralis Major, Sternal|Barbell|Lie supine on bench. Grasp barbell loaded with thick chains from each side, with overhand and slightly wider than shoulder width grip. Dismount barbell from rack over chest.Lower weight to chest. Press bar upward until arms are extended. Repeat.|Basic|https://www.rocketdogrescue.org/wp-content/uploads/2016/08/dog-working-out.jpg|False
Safety Barbell Standing Leg Calf Raise|Calf|Gastrocnemius|Barbell|Stand facing safety barbell on rack upper chest height and calf block on floor just below. Position toes and balls of feet on calf block with arches and heels extending off. Place hands on bar to each sides or on vertical rack bars. Position head in yoke with padded bar around shoulders. Dismount bar from rack by standing erect with safety bar, away yet close to rack.Raise heels by extending ankles as high as possible. Lower heels by bending ankles until calves are stretched. Repeat.|Basic|https://www.rocketdogrescue.org/wp-content/uploads/2016/08/dog-working-out.jpg|False
Lying Piriformis Stretch (single leg)|External Rotators|Piriformis|Stretch|Lie on floor or mat. Lift one leg and grasp ankle and knee with both hands.Pull thigh toward torso while keeping knee over torso. Hold stretch. Repeat with opposite leg.|Basic|https://www.rocketdogrescue.org/wp-content/uploads/2016/08/dog-working-out.jpg|False
Cable Bar Military Press|Front Delt|Deltoid, Anterior|Cable Bar|Stand facing cable bar, mounted on each side to upper waist height narrow double pulley cables. Grasp cable bar with overhand grip, slightly wider than shoulder width. Position cable bar upper chest height. Stand directly between both cable pulleys with one foot forward and other foot back.Press cable bar upward until arms are extended overhead. Return to upper chest and repeat.|Basic|https://www.rocketdogrescue.org/wp-content/uploads/2016/08/dog-working-out.jpg|False
Lever Incline Fly|Upper Chest|Pectoralis Major, Clavicular|Lever (selectorized)|Lie supine on bench. Position inside of forearms under roller pads with arms out to each side. Slightly bend elbows and internally rotate shoulders so elbows are back.Raise lever upward and together in hugging motion. Lower weight until slight stretch is felt in chest or shoulder. Repeat.|Basic|https://www.rocketdogrescue.org/wp-content/uploads/2016/08/dog-working-out.jpg|False
Sled Single Leg Lying Leg Press|Quads|Quadriceps|Leg Presses|Lie supine on platform with shoulders against pad. Place foot slightly low on platform. Position other leg with lower leg parallel to platform.Push platform by extending knee and hip until knee is straight. Return by bending hip and knee of supporting leg until knee is just short of complete flexion or until hip is completely flexed. Repeat. Continue with opposite leg.|Basic|https://www.rocketdogrescue.org/wp-content/uploads/2016/08/dog-working-out.jpg|False
Self-assisted Single Leg Reclining Squat (pole)|Quads|Quadriceps|Self-assisted|Stand with feet behind vertical pole. Grasp pole with both hands, waist to hip height. Balance on one leg with opposite leg raised up off of floor to side of pole.Squat down while keeping leg elevated off of floor. With arms slightly flexed, lean back slightly while only allowing knee to travel forward slightly. Keep back straight and supporting knee pointed same direction as supporting foot. Descend to lowest position. Raise body back up to original position while keeping knee behind bar and arms slightly flexed until knee and hip of supporting leg is straight. Repeat and continue with opposite leg.|Basic|https://www.rocketdogrescue.org/wp-content/uploads/2016/08/dog-working-out.jpg|False
Lever Kneeling Leg Curl|Hamstrings|Hamstrings|Lever (selectorized)|Mount machine by placing supporting knee on horizontal pad and other leg under roller pad with knee against vertical pad. Grip handles and place forearm on padded arm rest.Raise ankle to back of thigh by flexing knee. Lower ankle until knee is straight. Repeat. Continue with opposite leg.|Basic|https://www.rocketdogrescue.org/wp-content/uploads/2016/08/dog-working-out.jpg|False
Incline Twisting Crunch (arms crossed)|Obliques|Obliques|Twisting Crunches|Hook feet under foot bar and lie supine on incline bench with hips bent. Cross arms on chest.Flex and twist waist to raise upper torso from bench to one side. Return until back of shoulders contact padded incline board. Repeat to opposite side alternating twists.|Basic|https://www.rocketdogrescue.org/wp-content/uploads/2016/08/dog-working-out.jpg|False
Lying Piriformis Stretch|External Rotators|Piriformis|Stretch|Lie on floor or mat with feet on floor and knees bent approximately 90 degrees. Cross thighs by lacing back of knee on thigh of other leg. Lift legs and hug both thighs locking both hands together behind knee of lower leg.Pull leg toward torso. Hold stretch. Repeat with opposite leg.|Basic|https://www.rocketdogrescue.org/wp-content/uploads/2016/08/dog-working-out.jpg|False
Lying Crossover Stretch|Obliques|Obliques|Stretch|On floor or mat, lie supine with arms extended to sides. Lift one leg straight up.Lower leg to opposite side toward hand. Hold stretch. Repeat with opposite side.|Basic|https://www.rocketdogrescue.org/wp-content/uploads/2016/08/dog-working-out.jpg|False
Weighted Single Leg Squat|Quads|Quadriceps|Weighted|Stand with arms extended out in front holding medicine ball or weight plate. Balance on one leg with opposite leg extended forward off of ground.Squat down as far as possible while keeping leg elevated off of floor. Keep supporting knee pointed same direction as foot supporting. Raise body   back up to original position until knee and hip of supporting leg is straight. Return and repeat. Continue with opposite leg.Supporting knee should point same direction as foot throughout movement. Range of motion will be improved with greater leg strength andAn easier, alternative style is to place barbell on back of shoulders and cross lower leg above knee of supporting leg or wrap one foot around back of supporting leg.|Basic|https://www.rocketdogrescue.org/wp-content/uploads/2016/08/dog-working-out.jpg|False
